{
  "pageInfo": {
    "pageId": "project.runtime",
    "sceneKey": "project.runtime",
    "pageName": "Project Runtime",
    "model": "project.project",
    "viewType": "form",
    "layoutType": "form",
    "renderMode": "governed",
    "contractVersion": "2.1.0",
    "clientType": "web_pc"
  },
  "layoutContract": {
    "pageId": "project.runtime",
    "layoutType": "form",
    "adaptMode": "pc",
    "containerTree": [
      {
        "containerId": "main.basic",
        "containerType": "group",
        "title": "Basic",
        "span": 12,
        "children": [],
        "widgetList": [
          {
            "widgetId": "field.name",
            "widgetType": "input",
            "fieldCode": "name",
            "label": "Name",
            "span": 6,
            "componentKey": "sc.input.text",
            "capabilities": [
              "clearable"
            ],
            "componentConfig": {}
          }
        ]
      }
    ],
    "layoutHints": {},
    "componentRegistry": {
      "sc.input.text": {
        "version": "1.0",
        "adapter": {
          "web_pc": "ElInput",
          "wx_mini": "WxInput",
          "harmony_h5": "H5Input"
        }
      }
    }
  },
  "statusContract": {
    "globalStatus": {
      "pageVisible": true,
      "pageAuth": "edit"
    },
    "containerStatus": [],
    "widgetStatus": [],
    "buttonStatus": [],
    "selectorStatus": [
      {
        "selector": "finance.*",
        "readonly": true
      }
    ]
  },
  "actionContract": {
    "actionRuleList": [
      {
        "actionId": "action.name.change",
        "triggerType": "change",
        "sourceWidgetId": "field.name",
        "targetIds": [],
        "dispatchMode": "serverDebounced",
        "targetScope": "widget",
        "refreshMode": "partial"
      }
    ],
    "dependencyGraph": {
      "field.name": [
        "action.name.change"
      ]
    }
  },
  "dataContract": {
    "mainData": {
      "name": "Example Project"
    },
    "tableRows": {},
    "relationRows": {},
    "dictData": {},
    "pagination": {},
    "dataSource": {
      "project": {
        "query": "project.read",
        "cachePolicy": "etag",
        "consistency": "strong",
        "subscription": false,
        "sourceAuthority": {
          "projection_only": true,
          "no_business_fact_authority": true,
          "fact_authority": "odoo.model:project.project"
        }
      }
    },
    "dataMeta": {}
  },
  "runtimeContract": {
    "patchStrategy": "incremental",
    "cachePolicy": "etag",
    "optimistic": false,
    "lazyContainer": [],
    "virtualization": {},
    "retryPolicy": {
      "maxRetries": 1
    },
    "patchOperations": [
      "replace",
      "merge",
      "append",
      "remove",
      "reorder",
      "invalidate"
    ],
    "aiEnvelope": {
      "allowed": true,
      "capabilities": [
        "contract.inspection"
      ]
    }
  },
  "formStructureContract": {
    "source": "ui.contract.v2.form_structure_contract",
    "structureVersion": "1.0",
    "model": "project.project",
    "viewType": "form",
    "mode": "business_task_form",
    "layoutPolicy": "overview_then_task_slots",
    "objectProfile": {
      "model": "project.project",
      "kind": "business_form",
      "factAuthority": "business_object_model_and_view"
    },
    "navigation": {
      "title": "业务办理"
    },
    "slots": [
      {
        "slot": "overview",
        "title": "办理总览",
        "role": "overview",
        "readonly": true,
        "fieldRefs": [
          "name"
        ]
      }
    ],
    "fieldRoles": {
      "name": {
        "role": "identity",
        "slot": "overview",
        "group": "overview"
      }
    },
    "sourceAuthority": {
      "kind": "unified_page_contract_v2",
      "runtime_carrier": "ui.contract.v2.form_structure_contract",
      "projection_only": true,
      "no_business_fact_authority": true,
      "governed_form_structure": true,
      "governance_source": {
        "source": "business_view_orchestration",
        "owner_layer": "business_view_orchestration",
        "business_config_contracts": [
          {
            "id": 1,
            "name": "fixture-form-structure",
            "version_no": 1
          }
        ],
        "legacy_field_policy_overlay": false
      }
    }
  },
  "meta": {
    "etag": "upc-v2-runtime-001",
    "snapshotId": "snapshot.upc.v2.runtime.001",
    "traceId": "trace.upc.v2.runtime.001",
    "requestId": "request.upc.v2.runtime.001",
    "sourceType": "ui.contract"
  }
}
